{
  "$schema": "https://json-schema.org/draft/2020-12/schema",
  "$id": "https://pocketjs.dev/schema/pocket-system-1.json",
  "title": "Pocket system, format 1",
  "type": "object",
  "additionalProperties": false,
  "required": [
    "$schema",
    "pocketSystem",
    "id",
    "name",
    "title",
    "version",
    "roles",
    "applications",
    "installation"
  ],
  "properties": {
    "$schema": {
      "const": "https://pocketjs.dev/schema/pocket-system-1.json"
    },
    "pocketSystem": {
      "const": 1
    },
    "id": {
      "type": "string",
      "minLength": 3,
      "pattern": "^[a-z0-9](?:[a-z0-9-]*[a-z0-9])?(?:\\.[a-z0-9](?:[a-z0-9-]*[a-z0-9])?)+$"
    },
    "name": {
      "type": "string",
      "minLength": 1,
      "maxLength": 64,
      "pattern": "^[a-z][a-z0-9]*(?:-[a-z0-9]+)*$"
    },
    "title": {
      "type": "string",
      "minLength": 1,
      "maxLength": 128
    },
    "version": {
      "type": "string",
      "pattern": "^(0|[1-9][0-9]*)\\.(0|[1-9][0-9]*)\\.(0|[1-9][0-9]*)(?:-[0-9A-Za-z-]+(?:\\.[0-9A-Za-z-]+)*)?(?:\\+[0-9A-Za-z-]+(?:\\.[0-9A-Za-z-]+)*)?$"
    },
    "roles": {
      "type": "object",
      "additionalProperties": false,
      "required": [
        "systemUI"
      ],
      "properties": {
        "systemUI": {
          "type": "string",
          "minLength": 3,
          "pattern": "^[a-z0-9](?:[a-z0-9-]*[a-z0-9])?(?:\\.[a-z0-9](?:[a-z0-9-]*[a-z0-9])?)+$"
        }
      }
    },
    "applications": {
      "type": "object",
      "additionalProperties": false,
      "required": [
        "installPolicy",
        "backgroundExecution",
        "catalog"
      ],
      "properties": {
        "installPolicy": {
          "type": "object",
          "additionalProperties": false,
          "required": [
            "model",
            "mutable"
          ],
          "properties": {
            "model": {
              "const": "managed"
            },
            "mutable": {
              "type": "boolean"
            }
          }
        },
        "backgroundExecution": {
          "enum": [
            "suspend",
            "continue"
          ]
        },
        "catalog": {
          "type": "array",
          "minItems": 1,
          "items": {
            "type": "object",
            "additionalProperties": false,
            "required": [
              "package",
              "manifest",
              "required"
            ],
            "properties": {
              "package": {
                "type": "string",
                "minLength": 3,
                "pattern": "^[a-z0-9](?:[a-z0-9-]*[a-z0-9])?(?:\\.[a-z0-9](?:[a-z0-9-]*[a-z0-9])?)+$"
              },
              "manifest": {
                "type": "string",
                "minLength": 1,
                "pattern": "^(?!/)(?!.*(?:^|/)\\.\\.(?:/|$))(?!.*\\\\).+\\.json$"
              },
              "required": {
                "type": "boolean"
              },
              "presentation": {
                "type": "object",
                "additionalProperties": false,
                "required": [
                  "title",
                  "viewport"
                ],
                "properties": {
                  "title": {
                    "type": "string",
                    "minLength": 1,
                    "maxLength": 128
                  },
                  "viewport": {
                    "type": "array",
                    "items": {
                      "type": "integer",
                      "minimum": 1
                    },
                    "minItems": 2,
                    "maxItems": 2
                  }
                }
              }
            }
          }
        }
      }
    },
    "installation": {
      "type": "object",
      "additionalProperties": false,
      "required": [
        "installedPackages"
      ],
      "properties": {
        "installedPackages": {
          "type": "array",
          "uniqueItems": true,
          "items": {
            "type": "string",
            "minLength": 3,
            "pattern": "^[a-z0-9](?:[a-z0-9-]*[a-z0-9])?(?:\\.[a-z0-9](?:[a-z0-9-]*[a-z0-9])?)+$"
          }
        }
      }
    }
  }
}
