{
  "$schema": "https://pocketjs.dev/schema/pocket-system-1.json",
  "pocketSystem": 1,
  "id": "dev.pocket-stack.desktop",
  "name": "pocket-desktop",
  "title": "Pocket Desktop",
  "version": "0.1.0",
  "roles": {
    "systemUI": "dev.pocket-stack.desk98"
  },
  "applications": {
    "installPolicy": {
      "model": "managed",
      "mutable": true
    },
    "backgroundExecution": "suspend",
    "catalog": [
      {
        "package": "dev.pocket-stack.desk98",
        "manifest": "apps/desk98/pocket.json",
        "required": true
      },
      {
        "package": "dev.pocket-stack.hero",
        "manifest": "apps/hero/pocket.json",
        "required": false,
        "presentation": { "title": "Hero", "viewport": [640, 360] }
      },
      {
        "package": "dev.pocket-stack.settings",
        "manifest": "apps/settings/pocket.json",
        "required": false,
        "presentation": { "title": "Settings", "viewport": [480, 272] }
      },
      {
        "package": "dev.pocket-stack.motions",
        "manifest": "apps/motions/pocket.json",
        "required": false,
        "presentation": { "title": "Motions", "viewport": [480, 272] }
      },
      {
        "package": "dev.pocket-stack.cards",
        "manifest": "apps/cards/pocket.json",
        "required": false,
        "presentation": { "title": "Cards", "viewport": [480, 272] }
      },
      {
        "package": "dev.pocket-stack.chrome",
        "manifest": "apps/chrome/pocket.json",
        "required": false,
        "presentation": { "title": "Chrome", "viewport": [480, 272] }
      },
      {
        "package": "dev.pocket-stack.cursor",
        "manifest": "apps/cursor/pocket.json",
        "required": false,
        "presentation": { "title": "Cursor", "viewport": [480, 272] }
      },
      {
        "package": "dev.pocket-stack.gallery",
        "manifest": "apps/gallery/pocket.json",
        "required": false,
        "presentation": { "title": "Gallery", "viewport": [480, 272] }
      },
      {
        "package": "dev.pocket-stack.library",
        "manifest": "apps/library/pocket.json",
        "required": false,
        "presentation": { "title": "Library", "viewport": [480, 272] }
      },
      {
        "package": "dev.pocket-stack.music",
        "manifest": "apps/music/pocket.json",
        "required": false,
        "presentation": { "title": "Music", "viewport": [480, 272] }
      },
      {
        "package": "dev.pocket-stack.notifications",
        "manifest": "apps/notifications/pocket.json",
        "required": false,
        "presentation": { "title": "Notifications", "viewport": [480, 272] }
      },
      {
        "package": "dev.pocket-stack.stats",
        "manifest": "apps/stats/pocket.json",
        "required": false,
        "presentation": { "title": "Stats", "viewport": [480, 272] }
      }
    ]
  },
  "installation": {
    "installedPackages": [
      "dev.pocket-stack.desk98",
      "dev.pocket-stack.hero",
      "dev.pocket-stack.settings",
      "dev.pocket-stack.motions",
      "dev.pocket-stack.cards",
      "dev.pocket-stack.chrome",
      "dev.pocket-stack.cursor",
      "dev.pocket-stack.gallery",
      "dev.pocket-stack.library",
      "dev.pocket-stack.music",
      "dev.pocket-stack.notifications",
      "dev.pocket-stack.stats"
    ]
  }
}
